,Anime,Genre,Description,Studio,Year,Rating
1,Kobayashi-san Chi no Maid Dragon,"['Fantasy', 'Slice of Life']","As Kobayashi sets off for another day at work, she opens her apartment door only to be met by an unusually frightening sight—the head of a dragon, staring at her from across the balcony. The dragon immediately transforms into a cute, busty, and energetic young girl dressed in a maid outfit, introducing herself as Tooru.

It turns out that the stoic programmer had come across the dragon the previous night on a drunken excursion to the mountains, and since the mythical beast had nowhere else to go, she had offered the creature a place to stay in her home. Thus, Tooru had arrived to cash in on the offer, ready to repay her savior's kindness by working as her personal maidservant. Though deeply regretful of her words and hesitant to follow through on her promise, a mix of guilt and Tooru's incredible dragon abilities convinces Kobayashi to take the girl in.

Despite being extremely efficient at her job, the maid's unorthodox methods of housekeeping often end up horrifying Kobayashi and at times bring more trouble than help. Furthermore, the circumstances behind the dragon's arrival on Earth seem to be much more complicated than at first glance, as Tooru bears some heavy emotions and painful memories. To top it all off, Tooru's presence ends up attracting several other mythical beings to her new home, bringing in a host of eccentric personalities. Although Kobayashi makes her best effort to handle the crazy situation that she has found herself in, nothing has prepared her for this new life with a dragon maid.

[Written by MAL Rewrite]",Kyoto Animation,"Jan 12, 2017",
2,Youjo Senki,Action,"Tanya Degurechaff is a young soldier infamous for predatorial-like ruthlessness and an uncanny, tactical aptitude, earning her the nickname of the ""Devil of the Rhine."" Underneath her innocuous appearance, however, lies the soul of a man who challenged Being X, the self-proclaimed God, to a battle of wits—which resulted in him being reincarnated as a little girl into a world of magical warfare. Hellbent on defiance, Tanya resolves to ascend the ranks of her country's military as it slowly plunges into world war, with only Being X proving to be the strongest obstacle in recreating the peaceful life she once knew. But her perceptive actions and combat initiative have an unintended side effect: propelling the mighty Empire into becoming one of the most powerful nations in mankind's history.

[Written by MAL Rewrite]",Nut,"Jan 6, 2017",
3,Masamune-kun no Revenge,"['Comedy', 'Romance']","When Masamune Makabe was a child, he was rejected by a rich, beautiful girl named Aki Adagaki, who gave him the nickname ''Piggy'' for being overweight. Devastated, Masamune put great effort into working out to improve his appearance. Now a handsome yet narcissistic high school student, Masamune is determined to exact revenge—he will have Aki fall madly in love with him and ultimately reject her the next time they meet.

To his surprise, Masamune discovers he has transferred into Aki's school. Setting his plan into motion, Masamune first begins to form a relationship with the ''Brutal Princess'' but, despite his efforts, fails miserably at his initial attempts. Shockingly, when Masamune finally progresses towards his vengeance, he receives a mysterious letter addressing him by his old nickname. Unless Masamune discovers the sender's identity, his plan is doomed before it even starts!

[Written by MAL Rewrite]",SILVER LINK.,"Jan 5, 2017",
4,Ao no Exorcist: Kyoto Fujouou-hen,"['Action', 'Fantasy']","The ExWire of True Cross Academy are beset with shock and fear in the aftermath of discovering that one of their own classmates, Rin Okumura, is the son of Satan. But for the moment, they have more pressing concerns than that of Rin's parentage: the left eye of the Impure King, a powerful demon, has been stolen from the academy's Deep Keep. After an attempt is made to steal the right eye in Kyoto as well, Rin and the other ExWires are sent to investigate the mystery behind the Impure King and the ultimate goal of the thief.

While this mission has them cooperating for the time being, Rin has never felt more distant from his fellow exorcists. In his attempt to reconcile with them, he undergoes specialized training to control his dark power. However, when the right eye is stolen not long after their arrival, the unthinkable threat of a traitor amongst them leaves them in need of all the power they can get.

[Written by MAL Rewrite]",A-1 Pictures,"Jan 7, 2017",
5,Kuzu no Honkai,"['Drama', 'Romance']","To the outside world, Hanabi Yasuraoka and Mugi Awaya are the perfect couple. But in reality, they just share the same secret pain: they are both in love with other people they cannot be with. 

Hanabi has loved her childhood friend and neighbor Narumi Kanai for as long as she can remember, so she is elated to discover that he is her new homeroom teacher. However, Narumi is soon noticed by the music teacher, Akane Minagawa, and a relationship begins to blossom between them, much to Hanabi's dismay. 

Mugi was tutored by Akane in middle school, and has been in love with her since then. Through a chance meeting in the hallway, he encounters Hanabi. As these two lonely souls spend more time together, they decide to use each other as a substitute for the one they truly love, sharing physical intimacy with one another in order to stave off their loneliness. 

[Written by MAL Rewrite]",Lerche,"Jan 13, 2017",
6,Little Witch Academia (TV),"['Adventure', 'Comedy', 'Fantasy']","""A believing heart is your magic!""—these were the words that Atsuko ""Akko"" Kagari's idol, the renowned witch Shiny Chariot, said to her during a magic performance years ago. Since then, Akko has lived by these words and aspired to be a witch just like Shiny Chariot, one that can make people smile. Hence, even her non-magical background does not stop her from enrolling in Luna Nova Magical Academy.

However, when an excited Akko finally sets off to her new school, the trip there is anything but smooth. After her perilous journey, she befriends the shy Lotte Yansson and the sarcastic Sucy Manbavaran. To her utmost delight, she also discovers Chariot's wand, the Shiny Rod, which she takes as her own. Unfortunately, her time at Luna Nova will prove to more challenging than Akko could ever believe. She absolutely refuses to stay inferior to the rest of her peers, especially to her self-proclaimed rival, the beautiful and gifted Diana Cavendish, so she relies on her determination to compensate for her reckless behavior and ineptitude in magic.

In a time when wizardry is on the decline, Little Witch Academia follows the magical escapades of Akko and her friends as they learn the true meaning of being a witch. 

[Written by MAL Rewrite]",Trigger,"Jan 9, 2017",
7,Gabriel DropOut,"['Comedy', 'Supernatural']","For centuries, Heaven has required its young angels to live and study among humans in order to become full-fledged angels. This is no different for top-of-her-class Gabriel White Tenma, who believes it is her mission to be a great angel who will bring happiness to mankind. However, Gabriel grows addicted to video games on Earth and eventually becomes a hikikomori. Proclaiming herself a ""Fallen Angel,"" she is apathetic to everything else—much to the annoyance of Vignette April Tsukinose, a demon whom Gabriel befriended in her angelic early days on Earth.

Vignette's attempts to revert Gabriel back to her previous self are in vain, as Gabriel shoots down any attempt to change her precious lifestyle. As they spend their time on Earth, they meet two eccentric personalities: the angel Raphiel Ainsworth Shiraha, Gabriel's classmate with a penchant for sadism, and the demon Satanichia McDowell Kurumizawa, a clumsy self-proclaimed future ruler of the Underworld.

Gabriel DropOut follows these four friends' comedic lives as they utterly fail to understand what it truly means to be a demon or an angel.

[Written by MAL Rewrite]",Doga Kobo,"Jan 9, 2017",
8,Demi-chan wa Kataritai,"['Comedy', 'Fantasy']","High school biology teacher Tetsuo Takahashi may look like your average everyday instructor, but beneath his gentle appearance lies something less ordinary: his fascination for the ""Ajin,"" more commonly known as ""Demi."" Although these half-human, half-monster beings have integrated into human society, Takahashi believes that much about them will remain unknown unless he interacts with them firsthand.

Demi-chan wa Kataritai follows Takahashi's daily life in Shibasaki High School together with his three Demi students—Hikari Takanashi, an energetic vampire; Kyouko Machi, a gentle dullahan; and Yuki Kusakabe, the shy snow woman. Along the way, Takahashi also meets fellow teacher Sakie Satou, a succubus with an aversion towards men. To fulfill his goal of learning more about the Demi, Takahashi decides to conduct casual interviews with the girls to learn more about their abilities, psyche, and interaction with human society. As Takahashi strengthens his bond with his students, he soon discovers that the Demi are not as unusual as he initially believed.

[Written by MAL Rewrite]",A-1 Pictures,"Jan 8, 2017",
9,Fuuka,"['Drama', 'Romance', 'Ecchi']","The story follows the life of Yuu Haruna, who recently moved into Tokyo with his sisters after their father is forced to transfer overseas on work.

On his way to buy dinner while looking at his Twitter account, a high school girl suddenly crashes into him. Thinking he was taking upskirt pictures of her, the girl takes Yuu's phone, breaks it, and slaps him before leaving Yuu lying on the ground. As it turns out, this girl—Fuuka Akitsuki—also goes to the school Yuu is transferring to.

Unlike most people, Fuuka doesn't own a cellphone; she even listens to music using a CD player. Eventually these two become closer, and decide to form a band with their friends and enter the professional world of music. With Fuuka around, what will now become of Yuu's new life in Tokyo?

[Written by MAL Rewrite]",Diomedéa,"Jan 6, 2017",
10,Gintama.,"['Action', 'Comedy', 'Sci-Fi']","After joining the resistance against the bakufu, Gintoki and the gang are in hiding, along with Katsura and his Joui rebels. The Yorozuya is soon approached by Nobume Imai and two members of the Kiheitai, who explain that the Harusame pirates have turned against 7th Division Captain Kamui and their former ally Takasugi. The Kiheitai present Gintoki with a job: find Takasugi, who has been missing since his ship was ambushed in a Harusame raid. Nobume also makes a stunning revelation regarding the Tendoushuu, a secret organization pulling the strings of numerous factions, and their leader Utsuro, the shadowy figure with an uncanny resemblance to Gintoki's former teacher.

Hitching a ride on Sakamoto's space ship, the Yorozuya and Katsura set out for Rakuyou, Kagura's home planet, where the various factions have gathered and tensions are brewing. Long-held grudges, political infighting, and the Tendoushuu's sinister overarching plan finally culminate into a massive, decisive battle on Rakuyou.

[Written by MAL Rewrite]",Bandai Namco Pictures,"Jan 9, 2017",8.99
11,Seiren,Romance,"For high school students like Shouichi Kamita, university entrance exams and the future are common concerns. It is also during this time in life that a mysterious emotion that vexes people of all ages may begin to weigh upon one's mind—love.

At this point in his teenage years, Shouichi finds three girls he could see himself having a future with: the ever-cheerful Hikari Tsuneki, who teases Shouichi without mercy, but actually has a softer side; the competitive gamer, Tooru Miyamae, who has difficulty communicating with others; and Shouichi's childhood friend, Kyouko Touno, the sometimes immature shoujo manga enthusiast. Seiren follows Shouichi's relationships with these three girls across three separate arcs, as their feelings grow from mutual interest and blossom into something more beautiful.

[Written by MAL Rewrite]",AXsiZ,"Jan 6, 2017",
12,Shouwa Genroku Rakugo Shinjuu: Sukeroku Futatabi-hen,Drama,"Even after having risen to the utmost rank of shun'ichi, Yotarou struggles to find his own identity in the world of rakugo. Caught between his master's teachings and the late Sukeroku's unique style, his performance lacks an important ingredient—ego. And while his popularity packs the theaters, he is but one of the few; rakugo is under threat of being eclipsed.

Meanwhile Yakumo, regarded by many as the last bastion of preserving the popularity of rakugo, struggles to cope with his elderly state. Even though his performances are still stellar, he fears that he is nearing his limits. His doubts grow stronger as an old friend creeps ever closer. Konatsu, for her part, attempts to raise her son as a single mother, which Yotarou is heavily opposed to. Instead, he seeks to persuade her to marry him and in turn raise her son as his own.

In Shouwa Genroku Rakugo Shinjuu: Sukeroku Futatabi-hen, the curtains fall on Yotarou and Yakumo's story, tasked with restoring the near-obsolete art form as well as overcoming their internal conflicts.

[Written by MAL Rewrite]",Studio Deen,"Jan 7, 2017",8.75
13,Tales of Zestiria the Cross 2nd Season,"['Action', 'Adventure', 'Fantasy']",The second season of Tales of Zestiria the Cross. ,ufotable,"Jan 8, 2017",
14,ACCA: 13-ku Kansatsu-ka,"['Drama', 'Fantasy', 'Mystery']","ACCA—a national body of the kingdom of Dowa that provides public services to the citizens of the country—was established as part of the peace settlement between the king of Dowa and the 13 states of the country during a revolt. One hundred years later, Dowa is in a period of unprecedented peace, due in part to the ACCA system. However, rumors of a coup d'état start to surface. Jean Otus, the second-in-command of the inspection department of ACCA, is charged with inspecting all 13 state branches. What will he discover as he performs his audit?

Intriguing and mysterious, ACCA: 13-ku Kansatsu-ka is a politically-themed mystery that reveals a world of diverse cultures and lifestyles, with intricate connections between its characters, as the truth of the coup d'état slowly unfolds.

[Written by MAL Rewrite]",Madhouse,"Jan 10, 2017",
15,Akiba's Trip The Animation,"['Action', 'Comedy', 'Supernatural', 'Ecchi']","Otaku siblings Tamotsu and Niwaka Denkigai are shopping in Akihabara when it is overrun by vampiric cosplaying monsters! These creatures, known as ""Bugged Ones,"" can possess anyone they bite and soon they begin causing mayhem across the city. As Tamotsu finds himself at the mercy of one of these creatures, he is rescued by the mysterious baseball bat-wielding Matome Mayonaka. Together, they fight through several more encounters with the Bugged Ones, but before long, Tamotsu is fatally wounded protecting Matome. With no other choice, she revives him as a high level Bugged One—just like her! 

Tamotsu and Matome, along with excitable otaku cosplayer Arisa Ahokainen, make up the group ""The Electric Mayonnaise"" and they begin dispatching the Bugged Ones in the only way they know how: by ripping off their clothes and exposing them to sunlight!

[Written by MAL Rewrite]",Gonzo,"Jan 4, 2017",
16,ChäoS;Child,"['Mystery', 'Sci-Fi', 'Supernatural']","A series of gruesome murders dubbed ""New Generation Madness"" once induced mass hysteria in Shibuya. At its peak during a frenzied riot, a sudden earthquake reduced the district into nothing but rubble, while leaving surrounding wards strangely intact.

Six years later, in a newly rebuilt Shibuya, mysterious deaths begin to crop up again. It is not long before third-year student Takuru Miyashiro realizes a connection: the dates of the recent murders match those of the New Generation Madness incidents. He, along with several members of his school's newspaper club, decide to delve deeper into the mystery, only to find themselves stranded in the middle of a new crime scene themselves...

[Written by MAL Rewrite]",SILVER LINK.,"Jan 11, 2017",
17,Urara Meirochou,"['Comedy', 'Fantasy', 'Slice of Life']","Labyrinth Town is a legendary city composed of ten districts, home to witches and diviners alike. In the outermost district of this maze, many young girls begin training to join the ranks of the ""Urara,"" a group of women known far and wide for their ability to divine the answers to the world's most difficult questions. Chiya, a wild girl raised amongst the animals in the mountains, is invited to take her rightful place as a first rank urara. By joining them, she hopes to divine the location of her long-lost mother.

Chiya quickly makes three friends: studious Kon Tatsumi, aspiring witch Koume Yukimi, and reticent Nono Natsume. Armed with only their own ingenuity and a vague connection to the gods, they begin their journey in the way of the urara.

[Written by MAL Rewrite]",J.C.Staff,"Jan 6, 2017",
18,One Room,Slice of Life,"Having just moved into a new apartment building, Yui Hanasaka makes a customary visit to greet her neighbor. When she learns that he is an upperclassman at the university she aspires to attend, she asks for his help to pass her entrance exams. Meanwhile, Natsuki Momohara decides to visit her older brother, who lives alone in an apartment in Tokyo. Elsewhere, aspiring singer Moka Aoshima reunites with her childhood friend, who is a hopeful novelist. 

Three stories, although seemingly unrelated, contain the same essence: strings of fate will bind together those who share the same destiny, and one needs to look no further than a single apartment room.

[Written by MAL Rewrite]",Typhoon Graphics,"Jan 11, 2017",
19,Chain Chronicle: Haecceitas no Hikari,"['Action', 'Adventure', 'Fantasy']","Set in the land of Yuguto, the people thought that the land they live is the size of the world, but it's actually divided into several areas, each with a respective king. Even though there were small wars among areas, the kings had roundtable meetings to maintain peace and balance. It was until a dark group of dark monsters appeared...

(Source: MAL News)",Graphinica,"Jan 8, 2017",
20,Rewrite 2nd Season,"['Action', 'Comedy', 'Fantasy', 'Romance', 'Supernatural']",The second season of the Rewrite series which adapts Moon and Terra routes.,8bit,"Jan 14, 2017",
21,Hand Shakers,Action,"Those who receive the Revelation of Babel must overcome many battles and trials. By grasping the hand of their special partner, these ""Hand Shakers"" transport themselves to the realm of Ziggurat, an alternate dimension where time no longer exists. Each pair of Hand Shakers must battle it out for the right to meet with God, who will reward them by granting them a single wish.

Tazuna Takatsuki, a high school student with a penchant for fixing things, is one of these Hand Shakers. After receiving a request for repairs from Professor Makihara of a nearby university, Tazuna stumbles upon Koyori Akutagawa, a bedridden girl that reminds him of his deceased sister Musubu. Remembering her dying wish to never let go of her hand, Tazuna grasps Koyori's hand and awakens his power as a Hand Shaker. However, Koyori's life is directly tied to her status as a Hand Shaker, meaning if Tazuna was to ever let go of her hand she would die. With meeting God being their only hope for saving her, the duo must find a way to make their unique powers mesh together, overcome the opposing Hand Shakers, and make their wish come true.

[Written by MAL Rewrite]
",GoHands,"Jan 11, 2017",
22,Super Lovers 2,"['Boys Love', 'Comedy', 'Drama', 'Romance', 'Slice of Life']",Second season of Super Lovers.,Studio Deen,"Jan 12, 2017",
23,BanG Dream!,[],"When Kasumi Toyama was out camping as a child, she heard the rhythm of the ""Star Beat"" while admiring the starry night sky. This sparkling, heart-pounding sound left a lasting impression on her, and since then, she has constantly been seeking to rediscover that exciting thrill.

Now, as a newly enrolled student of Hanasakigawa Girls' High School, Kasumi is more determined than ever to find that long-lost sensation again. She attempts a myriad of school club activities, and even considers taking up a part-time job, but none of these feel suitable for her. That is, until she chances upon a star-shaped guitar in the storage room of an old pawn shop. It leads her to a live house, where she is captivated by watching a live performance for the first time. Spurred from the adrenaline, she instantly decides to form a band without even really knowing why. However, such a venture requires her to confront various hurdles with new friends she makes along the way, all in her pursuit to encounter that twinkling, heart-throbbing ardor once more.

[Written by MAL Rewrite]",Issen,"Jan 21, 2017",
24,Kemono Friends,"['Adventure', 'Comedy', 'Fantasy']","Japari Park is an untamed paradise where many humanoid animals, known as ""Friends,"" live their everyday lives in all corners of the natural environmental park.

One lazy afternoon in the savannah area, the energetic Serval encounters a peculiar new Friend. Curious, she swiftly takes down the Friend, named Kaban, to try and discover what species she is. To Serval's disappointment, not even Kaban herself knows the answer.

The two become friends and set out on a grand adventure through the many habitats, landmarks, and attractions of Japari Park. Their destination is the park library, where they hope to shed some light on Kaban’s identity. Along the way, they meet many other Friends, looking into their lives and helping them out. However, they soon begin to uncover the sinister reality behind the park and their own existence.

[Written by MAL Rewrite]",Yaoyorozu,"Jan 11, 2017",
25,Yowamushi Pedal: New Generation,Sports,"Third season of the Yowamushi Pedal series.

With the team's combined strength, the Sohoku High bicycle racing club beat reigning champions Hakone Academy at the Interhigh national race and achieved an impressive overall victory. Now that their hot summer has ended and third-years Kinjou, Makishima, and Tadokoro have retired from the team, first-year participants in the Interhigh Onoda Sakamichi, Imaizumi Shunsuke, and Naruko Shoukichi, along with their new captain second-year Teshima Junta and vice-captain Aoyagi Hajime begin preparing as a ""new team"" for their second consecutive championship at the next Interhigh. In order to retake their throne, their rivals Hakone Academy have also incorporated new members and begun training as a new team. Kyoto Fushimi High is lead by the monstrous racer Midousuji Akira. The nation's top schools are all honing their skills to reach the top of the Interhigh.

(Source: Crunchyroll)",TMS Entertainment,"Jan 10, 2017",
26,Nyanko Days,"['Comedy', 'Slice of Life']","Average high school student Yuuko Konagai tends to be rather shy and socially awkward. Due to this, besides earning rather mediocre grades, she barely has friends inside her class. However, after a monotonous day at school, she returns to her long-awaited haven—home with her cats Maa, Shi, and Ro! With their unique personalities, the three possess bodies similar to those of humans, retaining the ability to speak and communicate. Every day, the adorable bunch awaits their owner's return to shower her with much-needed companionship.

Nyanko Days highlights the life of Yuuko and her cats as they brighten up each moment and make new friends in the passing days.

[Written by MAL Rewrite]",EMT Squared,"Jan 8, 2017",
27,ēlDLIVE,"['Action', 'Sci-Fi']","Chuuta Kokonose is an orphan who lives with his aunt. For as long as he can remember, he's had a voice in his head, but other than that he's a normal boy—right until the day when a strange-looking thing follows him home and teleports him to a place filled with more fantastic creatures. It's a space police station, and Rein Brickke, the Chief of Solar System Department, tells him that he's been chosen by the computer as a possible candidate to join the police force. Misuzu Sonokata, a girl from Chuuta's school with an angelic face and ill temper who turns out to be one of Rein Brickke's subordinates, doesn't think him suitable for such a job. Chuuta, who was shocked at first, decides to take the aptitude test after being urged by the voice in his head and to prove Misuzu wrong.",Pierrot,"Jan 8, 2017",
28,Reikenzan: Eichi e no Shikaku,"['Comedy', 'Fantasy']","After two years of studying within the Reiken clan, Ouriku and other inexperienced disciples are ordered to descend to the temporal world for further studies, and Ouriku embarks the journey back to his birthplace.

(Source: ANN)",Studio Deen,"Jan 8, 2017",
29,Onihei,[],"The blade arts of the ""Devil"" tasked with striking down evils threatening a peaceful Edo! Heizou Hasegawa, upholding the role of chief officer protecting against crime and arson! In 1783, the heart of the Tenmei era, Hasegawa held the office of chief director of the department charged with sustaining safety in the region, suppressing the most vile of thieves and criminals, an individual largely feared, renowned as Devil Heizou...

(Source: MAL News)",Studio M2,"Jan 10, 2017",
