,Anime,Genre,Description,Studio,Year,Rating
30,Yami Shibai 7,"['Avant Garde', 'Horror', 'Supernatural']","A rusted door opens to a decrepit apartment filled with darkness. Inside, the masked Storyteller waits to spin more twisted tales of horror, inviting all to listen.

In one story, a woman is tormented by her past sins; in another, a man visits a chilling art exhibit, where things quickly go awry when he ignores the warnings regarding taking photographs. That is not all, though—an unsuspecting woman hears strange noises from her veranda, but when her boyfriend investigates, he receives the shock of his life; a lady receives a frantic call from her sister, who begs her to come to a phone booth, but when she arrives, she realizes that things are not as they appear; and a man looks for one of his belongings in his little sister's room, only to soon discover that a malevolent presence lives there. The Storyteller is all too eager to share these tales, which will no doubt shock and terrify his audience.

[Written by MAL Rewrite]",DRAWIZ,"Jul 8, 2019",
31,Re:Stage! Dream Days♪,Slice of Life,"Mana Shikimiya has just transferred into Marehoshi Academy, a school which requires each of its students to join one of the many sports or cultural clubs. After a quick tour of most of the clubs by the Student Council Vice President Minori Hasegawa, Mana stumbles upon the Lyrical Tradition Dance Club. There she meets its sole members: Mizuha Ichikishima and Sayu Tsukisaka. Drawn to their singing and dancing, Mana joins the club and together they work towards their dream of winning the Prism Stage—a national competition to determine the top idols of the country.

However, before Mana and her new friends can worry about the Prism Stage, there is a more immediate problem at hand: the club is about to be disbanded by the student council! Without enough members or any notable achievements, the club will be shut down and the members' dreams will be over before they've begun to pursue them. It's up to the three of them to find the additional club members they need and become an idol group strong enough to qualify for the Prism Stage and to win it as well.

[Written by MAL Rewrite]",Graphinica,"Jul 7, 2019",
32,Starmyu 3rd Season,Slice of Life,"Following a successful graduation performance, Yuuta Hoshitani and the rest of the second years begin preparations for the upcoming Ayanagi Festival. This year's festival is the first time the students will be without their Kao Council mentors, giving them the creative freedom to do what they want. Hoping to perform alongside each other for once, the second years decide to put on a joint production together. The festival’s opening ceremony will also serve another purpose—to reveal next year's Kao Council candidates. 

The Kao Council announces that Team Hiiragi was selected for the opening ceremony performance, preventing them from participating in the collaboration. This shocks and enrages Hoshitani and the others, driving a rift between them and the Kao Council. In an effort to realize their dreams, the students begin to hatch a plan to ensure that all of the second years can perform together on stage.

[Written by MAL Rewrite]",C-Station,"Jul 1, 2019",
34,Business Fish,"['Comedy', 'Slice of Life']",The anime features characters with human bodies and fish heads as office workers at an IT firm.,Workplace,"Jul 8, 2019",
35,Hakata Mentai! Pirikarako-chan,"['Comedy', 'Gourmet', 'Slice of Life']","A daily eating life happening at a street that seems like Hakata but not Hakata!?  Fairy of Mentaiko ""Pirikarako-chan"" goes around the street to solve (?)!",G-angle,"Jul 7, 2019",
36,Waresho! Warera! Shodobutsu Aigo Iinkai,Comedy,"Three girls come from another planet to save the mistreated animals of planet Earth. Black cat Amiru, squirrel Rumi, and rabbit Rie all make their way to Earth but Rie crashes her UFO! Lucky Amiru and Rumi run into Earth girl Minami and together set out to conquer the world!

(Source: Tokyo Otaku Mode)",nan,"Jul 2, 2019",
37,Hensuki▽,"['Comedy', 'Ecchi']",Short specials broadcast on AT-X and Gyao! at the end of each episode of Kawaiikereba Hentai demo Suki ni Natte Kuremasu ka?. Later included on Blu-ray/DVD volumes.,GEEK TOYS,"Jul 8, 2019",
38,Zannen na Ikimono Jiten (2019),"['Comedy', 'Slice of Life']",(No synopsis yet.),NHK Enterprises,"Jul 29, 2019",
39,Kimetsu no Yaiba,"['Action', 'Fantasy']","Ever since the death of his father, the burden of supporting the family has fallen upon Tanjirou Kamado's shoulders. Though living impoverished on a remote mountain, the Kamado family are able to enjoy a relatively peaceful and happy life. One day, Tanjirou decides to go down to the local village to make a little money selling charcoal. On his way back, night falls, forcing Tanjirou to take shelter in the house of a strange man, who warns him of the existence of flesh-eating demons that lurk in the woods at night.

When he finally arrives back home the next day, he is met with a horrifying sight—his whole family has been slaughtered. Worse still, the sole survivor is his sister Nezuko, who has been turned into a bloodthirsty demon. Consumed by rage and hatred, Tanjirou swears to avenge his family and stay by his only remaining sibling. Alongside the mysterious group calling themselves the Demon Slayer Corps, Tanjirou will do whatever it takes to slay the demons and protect the remnants of his beloved sister's humanity.

[Written by MAL Rewrite]",ufotable,"Apr 6, 2019",8.54
43,Fruits Basket 1st Season,"['Drama', 'Fantasy', 'Romance']","Tooru Honda has always been fascinated by the story of the Chinese Zodiac that her beloved mother told her as a child. However, a sudden family tragedy changes her life, and subsequent circumstances leave her all alone. Tooru is now forced to live in a tent, but little does she know that her temporary home resides on the private property of the esteemed Souma family. Stumbling upon their home one day, she encounters Shigure, an older Souma cousin, and Yuki, the ""prince"" of her school. Tooru explains that she lives nearby, but the Soumas eventually discover her well-kept secret of being homeless when they see her walking back to her tent one night.

Things start to look up for Tooru as they kindly offer to take her in after hearing about her situation. But soon after, she is caught up in a fight between Yuki and his hot-tempered cousin, Kyou. While trying to stop them, she learns that the Souma family has a well-kept secret of their own: whenever they are hugged by a member of the opposite sex, they transform into the animals of the Chinese Zodiac.

With this new revelation, Tooru will find that living with the Soumas is an unexpected adventure filled with laughter and romance.

[Written by MAL Rewrite]",TMS Entertainment,"Apr 6, 2019",8.22
46,Carole & Tuesday,"['Drama', 'Sci-Fi']","It has been 50 years since mankind began its migration to the terraformed Mars, where they live in comfort due to advancements in AI. Carole lives in the metropolis of Alba City, working part-time by day and playing keyboard by night. Tuesday has run away from her home in Hershell City to escape the grip of her wealthy family, and instead hopes to pursue music with her acoustic guitar.

After a fateful encounter, the two decide to perform music together. Up against the AI singers that dominate the music world, the two of them believe that together they can convey their feelings through their songs. Will hard work and luck be enough for the duo to create the biggest miracle that Mars has ever seen?

[Written by MAL Rewrite]",Bones,"Apr 11, 2019",
47,Kono Yo no Hate de Koi wo Utau Shoujo YU-NO,"['Drama', 'Sci-Fi']","Takuya Arima is a young student whose father, a historian who has conducted various researches, disappeared recently. During a summer vacation Takuya receives a peculiar package from his missing father, along with a letter containing information about the existence of various parallel worlds. At first Takuya doesn't take it seriously, but soon he realizes that he possesses a device that allows him to travel to alternate dimensions. Is his father alive, after all? If so, where is he?

(Source: VNDB)",feel.,"Apr 2, 2019",
53,Mix,"['Drama', 'Romance', 'Sports']","Because of the legend left by Tatsuya Uesugi, Meisei Academy High School was well-known for their strong baseball team. But 26 years after their glory, the team has not been able to keep their record and has since lost their fame.

Two stepbrothers, Souichirou and Touma Tachibana, aim to revive of the once-strong Meisei Academy baseball team and enter the National High School Baseball Championship.

Souichirou and Touma are second years in Meisei Academy Middle School. Both boys are talented baseball players. Souichirou has shown excellent skill as a catcher and batter. Though having an extraordinary skill as a pitcher, Touma no longer pitches due to a certain reason.

Once the two enter high school, they pair as a battery and aim to enter the National High School Baseball Championship!

(Source: YTV, edited)",OLM,"Apr 6, 2019",
54,Mobile Suit Gundam: The Origin - Advent of the Red Comet,"['Action', 'Sci-Fi']","What was the tragedy that decided the fates of Char Aznable, the man later nicknamed the ""Red Comet"" as an ace pilot of the Zeon forces, and his sister Sayla Mass?

The two siblings' journeys, brought on by the sudden death of their father Zeon Zum Deikun who was a leader of the Spacenoids, are depicted in the four episodes of ""Chronicle of Char and Sayla.""

The Zabi family who seize control of Side 3 and lead the Principality of Zeon, the early days of many renowned Zeon ace pilots who later fight in the One Year War, the secrets of mobile suit development, conflicts with the Earth Federation Forces, and the road leading to the outbreak of war—all will be revealed.

(Source: Official Website)

Note: A re-edited TV version of the six OVAs released from 2015 through 2018.
",Sunrise,"Apr 29, 2019",8.12
57,Bakugan: Battle Planet,"['Action', 'Fantasy']","The series follows pre-teens Dan Kouzo, Shun Kazami, Wynton Styles, Lia Venegas, and their dog Lightning. They are known as the ""Awesome Ones"" and make videos on the website ViewTube. Eventually, they stumble across a race of battling biomechanical creatures called Bakugan. They soon befriend the Bakugan and begin to battle each other with them, all while defending their neighborhood from thugs who use the Bakugan for malicious purposes. 

(Source: Wikipedia)",TMS Entertainment,"Apr 1, 2019",
58,Cardfight!! Vanguard: Zoku Koukousei-hen,Action,"Upon the conclusion of the Vanguard High School Koshien, Kouji Ibuki begins to have new nightmares. Nome Tatsunagi has Suiko summon him to the mansion where they learn he can see a Dark Tower called Sanctuary. Sanctuary is causing the timeline to be altered throughout history, and the only way to correct it is for Kouji to first correct his future mistake. Now Kouji and Suiko must travel the parallel world -if- and watch as Magical Girls Emi Sendou and Shuka summon Vanguard units to help correct history. Sadly the two can't help much as Cardfighting against real monsters doesn't do much good.

(Source: ANN)",OLM,"May 11, 2019",
59,Aikatsu Friends!: Kagayaki no Jewel,Slice of Life,"The story takes place two years after Aikatsu Friends! with Aine Yuuki now in high school. One day she has an encounter with the mysterious idol Hibiki Tenshou who wears the shining Jeweling Dress.
",Bandai Namco Pictures,"Apr 4, 2019",
65,TV Yarou Nanaana: Wakuwaku Doukutsu Land,"['Adventure', 'Comedy']","After the TV station gets acquired by ""Nanazon Prime Video,"" departments that don't get high ratings will be restructured (aka fired). The shooting crew takes on a large-scale plan for their survival. The Banakawa Family was an extremely wealthy family in the Edo period but their gold was hidden somewhere in a cave (that even the surviving members of the Banakawa Family can't find). So the crew's program will feature them exploring the underground world in search of this hidden treasure that so far major TV station networks with big budgets could not find.
",Studio Crocodile,"Apr 11, 2019",
68,Shounen Ashibe: Go! Go! Goma-chan 4,"['Comedy', 'Slice of Life']",Fourth season of Shounen Ashibe: Go! Go! Goma-chan.,Studio Palette,"Apr 2, 2019",
77,Daifuku-kun@Kin Tele 2nd Season,Comedy,(No synopsis yet.),nan,"Apr 5, 2019",
1,Shingeki no Kyojin Season 3 Part 2,"['Action', 'Drama']","Seeking to restore humanity's diminishing hope, the Survey Corps embark on a mission to retake Wall Maria, where the battle against the merciless ""Titans"" takes the stage once again.

Returning to the tattered Shiganshina District that was once his home, Eren Yeager and the Corps find the town oddly unoccupied by Titans. Even after the outer gate is plugged, they strangely encounter no opposition. The mission progresses smoothly until Armin Arlert, highly suspicious of the enemy's absence, discovers distressing signs of a potential scheme against them. 

Shingeki no Kyojin Season 3 Part 2 follows Eren as he vows to take back everything that was once his. Alongside him, the Survey Corps strive—through countless sacrifices—to carve a path towards victory and uncover the secrets locked away in the Yeager family's basement.

[Written by MAL Rewrite]",Wit Studio,"Apr 29, 2019",
2,One Punch Man 2nd Season,"['Action', 'Comedy']","In the wake of defeating Boros and his mighty army, Saitama has returned to his unremarkable everyday life in Z-City. However, unbeknownst to him, the number of monsters appearing is still continuously on the rise, putting a strain on the Hero Association’s resources. Their top executives decide on the bold move of recruiting hoodlums in order to help in their battle. But during the first meeting with these potential newcomers, a mysterious man calling himself Garou makes his appearance. Claiming to be a monster, he starts mercilessly attacking the crowd. 

The mysterious Garou continues his rampage against the Hero Association, crushing every hero he encounters. He turns out to be the legendary martial artist Silverfang’s best former disciple and seems driven by unknown motives. Regardless, this beast of a man seems unstoppable. Intrigued by this puzzling new foe and with an insatiable thirst for money, Saitama decides to seize the opportunity and joins the interesting martial arts competition. 

As the tournament commences and Garou continues his rampage, a new great menace reveals itself, threatening the entire human world. Could this finally be the earth-shattering catastrophe predicted by the great seer Madame Shibabawa? 

[Written by MAL Rewrite]
",J.C.Staff,"Apr 10, 2019",
4,Bungou Stray Dogs 3rd Season,"['Action', 'Mystery', 'Supernatural']","Following the conclusion of the three-way organizational war, government bureaucrat Ango Sakaguchi recalls an event that transpired years ago, after the death of the former Port Mafia boss. Osamu Dazai, still a new recruit at the time, was tasked with investigating rumors related to a mysterious explosion that decimated part of the city years ago—and its connection to the alleged reappearance of the former boss.

Due to circumstances out of his control, he is partnered with Chuuya Nakahara, the gifted yet impulsive leader of a rival clan known as the ''Sheep,'' to uncover the truth behind the case and shine a light on the myth of Arahabaki—the god of fire who might just lead Dazai to the case's solution.

Meanwhile, in the present day, it is business as usual once again for the Armed Detective Agency. Their peaceful break will not last for long, however, as enemies old and new gather their strength and prepare for another face-off.

[Written by MAL Rewrite]",Bones,"Apr 12, 2019",8.21
5,Kenja no Mago,"['Action', 'Comedy', 'Fantasy', 'Romance']","In the kingdom of Earlshide, Merlin Wolford was once regarded as a national hero, hailed for both his power and achievements. Preferring a quiet life however, he secludes himself deep in the rural woods, dedicating his time to raising an orphan that he saved. This orphan is Shin, a normal salaryman in modern-day Japan who was reincarnated into Merlin's world while still retaining his past memories. As the years pass, Shin displays unparalleled talent in both magic casting and martial arts, much to Merlin's constant amazement.

On his 15th birthday however, it becomes apparent that Shin only developed his combat skills and nothing else, leaving him with blatant social awkwardness, a lack of common sense, and a middling sense of responsibility. As a result, Shin enrolls in the kingdom's Magic Academy to hone his skills and mature among other teenagers. However, living a normal life is impossible, as he is established as a local celebrity almost as soon as he arrives.

Kenja no Mago follows Shin Wolford's high school life in the capital as he makes new friends, learns about the world, and fights off the various forces of evil surrounding him and his city.

[Written by MAL Rewrite]",SILVER LINK.,"Apr 10, 2019",
6,Bokutachi wa Benkyou ga Dekinai,"['Comedy', 'Romance']","Nariyuki Yuiga, an impoverished third-year high school student, works tirelessly to receive the VIP nomination, a scholarship that would cover all of his college tuition fees. In recognition of his hard work, the headmaster awards him the renowned scholarship.

However, this scholarship is given under one condition: he must tutor the school's geniuses in their weakest subjects! Joining his new brigade of pupils are the math maestro Rizu Ogata, who wants to study humanities; the literature legend Fumino Furuhashi, who wants to study science; and Yuiga's sports-savvy childhood friend, Uruka Takemoto, who is hopeless at everything else.

Bokutachi wa Benkyou ga Dekinai follows Yuiga as he tries to teach his three eccentric tutees in a series of strange and comedic antics. But as Ogata's and Furuhashi's ambitions conflict with their talents, will Yuiga be able to help his students achieve their dreams?

[Written by MAL Rewrite]
",Arvo Animation,"Apr 7, 2019",
7,Isekai Quartet,"['Comedy', 'Fantasy']","It is a normal day; everyone from deranged military girl Tanya Degurechaff and 16-year-old isekai protagonist Satou Kazuma to expansionist overlord Ainz Ooal Gown and demon sisters Rem and Ram go on with their daily lives. Suddenly, a conspicuous red button begging to be pressed appears before them. Overcome by curiosity, the otherworldly characters push the button, sending them to an unfamiliar world.

With no way of escaping, the characters must lead a normal school life and make acquaintances with the others. One thing is certain: the classroom full of fan-favorite eccentric personalities never gets boring!

[Written by MAL Rewrite]
",Studio PuYUKAI,"Apr 10, 2019",
8,Sewayaki Kitsune no Senko-san,"['Slice of Life', 'Supernatural']","Like many hardworking members of the workforce, Kuroto Nakano is perpetually stressed out by his job. Still, since he lives alone, he must carry on to sustain himself. Little do humans like Kuroto know, this stress takes the form of darkness residing within a person's body and will bring one's life to ruin. 

Fox deities can see this darkness and have the duty to save people before it is too late. To help rid Kuroto of his stress,  Senko-san, an eight hundred-year-old foxgirl, volunteers to take care of him, and will do everything she can to ease the tension in his weary soul.

[Written by MAL Rewrite]
",Doga Kobo,"Apr 10, 2019",
9,Nande Koko ni Sensei ga!?,"['Comedy', 'Ecchi']","Second year high school student Ichirou Satou has always been an average person—that is, until he runs into some not-so-average situations with his teacher, Kana ""The Demon"" Kojima. Kojima is Satou's Japanese language teacher with a reputation for being so ruthless that even school delinquents bow down to her. One fateful day, things escalate when Satou runs into Kojima in the restroom, leading them to share an intimate encounter that makes his imagination run wild for days after. 

Nande Koko ni Sensei ga? follows the daily life of Satou and his teacher as they continue to meet under similar conditions, growing ever closer with each encounter.

[Written by MAL Rewrite]",Tear Studio,"Apr 8, 2019",
11,Kono Oto Tomare!,"['Drama', 'Romance']","Gen Kudou, a koto maker, believes that his delinquent grandson Chika would never understand the profoundness of the traditional musical instrument. In an attempt to make up for his naivety and understand the words of his late grandfather, Chika tries to join the Tokise High School Koto Club. 

Even though the club is in dire need of members, new club president Takezou Kurata is unwilling to easily accept Chika's application due to his bad reputation. Nonetheless, after seeing Chika's seriousness and enthusiasm, Takezou allows the problem child to join, along with koto prodigy Satowa Houzuki and three of Chika's energetic friends. Kono Oto Tomare! follows the merry band of musicians as they aspire to play at the national competition.

[Written by MAL Rewrite]",Platinum Vision,"Apr 7, 2019",
12,Midara na Ao-chan wa Benkyou ga Dekinai,"['Comedy', 'Romance', 'Ecchi']","""Show them your A-O face!"" As an innocent child, Ao Horie would unhesitantly proclaim the origins of her name. Now that she is in high school, she is determined to study hard in order to one day escape the influence of her lascivious father, a famous erotic author. However, when the amiable Takumi Kijima confesses to Horie, her mind runs wild with scandalous thoughts.

Moans eager to escape, legs crossing, and a warmth spreading through her body, Horie cannot help but misconstrue Kijima's rather pure motivations. To make things worse, no matter how hard she tries to ward off Kijima, his advances do not stop. Now, if only she could just study!

[Written by MAL Rewrite]",SILVER LINK.,"Apr 6, 2019",
13,Hitoribocchi no Marumaru Seikatsu,"['Comedy', 'Slice of Life']","Many of us know what it is like to transition to a new school with few to no friends in a new environment, going through the arduous process of getting to know people again. Bocchi Hitori knows this struggle all too well, having just graduated from elementary school and thrown into middle school. Unfortunately, she suffers from extreme social anxiety: she faints when overwhelmed, vomits when nervous, and draws up ridiculously convoluted plans to avoid social contact. It does not help that her only friend from elementary school, Kai Yawara, will not be attending the same middle school as Bocchi. However, wanting to help her, Kai severs ties with Bocchi and promises to reconcile with her when she befriends all of her classmates in her new middle school class.

Even though Bocchi has no faith in herself, she is determined to be friends with Kai again. Summoning all of her courage, Bocchi takes on the daunting challenge of making friends with her entire class, starting with the delinquent-looking girl sitting in front of her...

[Written by MAL Rewrite]
",C2C,"Apr 6, 2019",
14,Senryuu Shoujo,"['Comedy', 'Slice of Life']","To the students of Karai High School, Nanako Yukishiro is a pretty, calm, and cute 16-year-old. However, Nanako is no ordinary girl, as she cannot speak! Instead, Nanako communicates through senryuu—17-syllable-long poems. 

Sixteen-year-old Eiji Busujima used to be delinquent in his middle school years. However, he has since turned over a new leaf due to his newfound love of senryuu. Despite his menacing looks, Eiji gets along well with Nanako as a fellow member of the Literature Club.

Even though Nanako is mute, the adorable pair have no problem communicating with each other. Senryuu Shoujo is a light and relaxing story of two teenagers' daily lives.

[Written by MAL Rewrite]
",Connect,"Apr 6, 2019",
15,Fairy Gone,"['Action', 'Fantasy', 'Supernatural']","""Once upon a time, fairies were tools of war.""

The story takes place in a world where fairies possess and dwell in animals, giving them mysterious abilities. By removing the organs of a possessed animal and transplanting them into humans, fairies can be summoned as an alter ego and be used as a weapon. Such individuals who used fairies as war tools were called ""Fairy Soldiers."" Once the war was over and they completed their roles, the soldiers lost their purpose. Some began working for the government, some joined the mafia, and some even became terrorists, as each chose their own way to live.

Nine years have passed since the war. The protagonist Mariya is a new recruit of ""Dorothea,"" an organization which investigates and suppresses fairy-related crimes. Amidst the unstable political situation, criminals with lingering wounds from the war and past conflicts emerge and engage in terrorism as an act of revenge. This is the story of Fairy Soldiers, fighting for their own justice in a chaotic postwar world.

(Source: MAL News)",P.A. Works,"Apr 8, 2019",
16,Gunjou no Magmell,"['Action', 'Adventure', 'Fantasy']","A new era of exploration begins with the sudden appearance of a new continent known as Magmell. Magmell's vast trove of never-before-seen natural resources spurs on the exploration of its vast landscape. However, the unknown is not always docile. In order to sustain the expeditions, people known as ""anglers"" specialize in dealing with Magmell's dangerous wildlife. One such angler is the highly-skilled and experienced Inyou, who performs search and rescue operations for clients with the help of his assistant, Zero.

[Written by MAL Rewrite]
",Pierrot Plus,"Apr 7, 2019",
