,Anime,Genre,Description,Studio,Year,Rating
0,Re:Zero kara Hajimeru Isekai Seikatsu 2nd Season,"['Drama', 'Fantasy', 'Suspense']","A reunion that was supposed to spell the arrival of peaceful times is quickly shattered when Subaru Natsuki and Emilia return to Irlam village. Witnessing the devastation left behind by the calamities known as Sin Archbishops, Subaru sinks into the depths of despair as his ability to redo proves futile.

As the group makes their way to the Sanctuary in search of answers, Subaru has an unexpected encounter with the Witch of Greed—Echidna. Subjected to her untamed rhythm, he is forced to dive into the spirals of the past and future. At the same time, several mysterious threats set their sights on the Sanctuary, heralding a horrific fate for the hapless people trapped within.

Everlasting contracts, past sins, and unrequited love will clash and submerge into a river of blood in the second season of Re:Zero kara Hajimeru Isekai Seikatsu. Pushed to the brink of hopelessness, how long will Subaru's resolve to save his loved ones last?

[Written by MAL Rewrite]",White Fox,"Jul 8, 2020",8.37
1,"Kanojo, Okarishimasu","['Comedy', 'Romance']","Kazuya Kinoshita is a 20-year-old college student who has a wonderful girlfriend: the bright and sunny Mami Nanami. But suddenly, he doesn't. Without warning, Mami breaks up with him, leaving him utterly heartbroken and lonely. Seeking to soothe the pain, he hires a rental girlfriend through an online app. His partner is Chizuru Mizuhara, who through her unparalleled beauty and cute demeanor, manages to gain Kazuya's affection.

But after reading similar experiences other customers had had with Chizuru, Kazuya believes her warm smile and caring personality were all just an act to toy with his heart, and he rates her poorly. Aggravated, Chizuru lambastes him for his shameless hypocrisy, revealing her true pert and hot-tempered self. This one-sided exchange is cut short, however, when Kazuya finds out that his grandmother has collapsed.

They dash toward the hospital and find Kazuya's grandmother already in good condition. Baffled by Chizuru's presence, she asks who this girl might be. On impulse, Kazuya promptly declares that they are lovers, forcing Chizuru to play the part. But with Kazuya still hung up on his previous relationship with Mami, how long can this difficult client and reluctant rental girlfriend keep up their act?

[Written by MAL Rewrite]",TMS Entertainment,"Jul 11, 2020",
2,The God of High School,"['Action', 'Fantasy', 'Sci-Fi', 'Supernatural']","The ""God of High School"" tournament has begun, seeking out the greatest fighter among Korean high school students! All martial arts styles, weapons, means, and methods of attaining victory are permitted. The prize? One wish for anything desired by the winner.

Taekwondo expert Jin Mo-Ri is invited to participate in the competition. There he befriends karate specialist Han Dae-Wi and swordswoman Yu Mi-Ra, who both have entered for their own personal reasons. Mo-Ri knows that no opponent will be the same and that the matches will be the most ruthless he has ever fought in his life. But instead of being worried, this prospect excites him beyond belief.

A secret lies beneath the facade of a transparent test of combat prowess the tournament claims to be—one that has Korean political candidate Park Mu-Jin watching every fight with expectant, hungry eyes. Mo-Ri, Dae-Wi, and Mi-Ra are about to discover what it really means to become the God of High School.

[Written by MAL Rewrite]",MAPPA,"Jul 6, 2020",
3,"Maou Gakuin no Futekigousha: Shijou Saikyou no Maou no Shiso, Tensei shite Shison-tachi no Gakkou e Kayou","['Action', 'Fantasy']","In the distant past, a war between humans and demons brought about widespread chaos and bloodshed. To put an end to this seemingly endless conflict, Demon King Anos Voldigoad willingly sacrificed his life, hoping to be reborn in a peaceful future.

In preparation for their king's return, the demon race created the Demon King Academy, an elite institution tasked with determining Anos' identity when he reawakens. He reincarnates two millennia later, but to his surprise, he soon learns that the level of magic in the world has drastically waned during his absence. Moreover, when he enrolls at the academy to reclaim his rightful title, he finds out that demonkind remembers him differently. His personality, his deeds, and even his legacy are all falsified—masked beneath the name of an impostor. This ""lack"" of common knowledge renders him the academy's outlier—a misfit never before seen in history.

Despite these drawbacks, Anos remains unfazed. As he sets out to uncover those altering his glorious past, he takes it upon himself to make his descendants recognize that their ruler has finally returned.

[Written by MAL Rewrite]",SILVER LINK.,"Jul 4, 2020",
4,Enen no Shouboutai: Ni no Shou,"['Action', 'Supernatural']","After his confrontation in the Nether with his younger brother Shou, Shinra Kusakabe's resolve to become a hero that saves lives from the flame terror strengthens. Finding a way to turn the Infernals back into people, unraveling the mystery of the Evangelist and Adolla Burst, and saving his mother and Shou—these are the goals Shinra has in mind. However, he has come to realize that attaining these goals will not be easy, especially with the imminent danger the Evangelist poses.

The Evangelist's plan is clear: to gather the eight pillars—the individuals who possess Adolla Burst—and sacrifice them to recreate the Great Cataclysm from 250 years ago. Having been revealed by the First Pillar that the birth of a new pillar is approaching, Shinra is determined to protect his fellow pillars from the Evangelist. Thus, the fiery battle between the Special Fire Force and the Evangelist ignites. Together with the Special Fire Force, Shinra's fight continues as he uncovers the truth about the Great Cataclysm and the nature of Adolla Bursts, as well as the mysteries behind human combustion. 

[Written by MAL Rewrite]",David Production,"Jul 4, 2020",
5,Yahari Ore no Seishun Love Comedy wa Machigatteiru. Kan,"['Comedy', 'Romance']","Resolved to become a more independent person, Yukino Yukinoshita decides to smoothen things out with her parents, and the first step toward achieving that goal is to prove herself.

As graduation draws closer for the third-year students, Iroha Isshiki—the president of the student council—requests a graduation prom in collaboration with the Volunteer Service Club. Yukino accepts this request of her own volition, hoping to use it as a chance to demonstrate her self-reliance, but what lies ahead of her may prove to be a hard hurdle to cross.

Yahari Ore no Seishun Love Comedy wa Machigatteiru. Kan revolves around the graduation prom as emotions are poured into the preparations for the event. At the same time, a chance for the Volunteer Service Club members to better understand each other presents itself. And thus, Hachiman Hikigaya's hectic and bittersweet high school life begins to draw to a close.

[Written by MAL Rewrite]",feel.,"Jul 10, 2020",8.38
6,Great Pretender,"['Action', 'Adventure', 'Mystery']","A series of unfortunate events has led Makoto ""Edamame"" Edamura to adopt the life of crime—pickpocketing and scamming others for a living. However, after swindling a seemingly clueless tourist, Makoto discovers that he was the one tricked and, to make matters worse, the police are now after him. 

While making his escape, he runs into the tourist once again, who turns out to be a fellow con man named Laurent Thierry, and ends up following him to Los Angeles. In an attempt to defend his self-proclaimed title of ""Japan's Greatest Swindler,"" Makoto challenges his rival to determine the better scammer. Accepting the competition, Laurent drops them off outside a huge mansion and claims that their target will be the biggest mafia boss on the West Coast.

Jumping from city to city, Great Pretender follows the endeavors of Makoto alongside the cunning Laurent and his colorful associates in the world of international high-stakes fraud. Soon, Makoto realizes that he got more than what he bargained for as his self-declared skills are continually put to the test.

[Written by MAL Rewrite]",Wit Studio,"Jul 9, 2020",8.26
7,Sword Art Online: Alicization - War of Underworld 2nd Season,"['Action', 'Adventure', 'Fantasy']","The final battle against the Dark Territory drags on, as players from all over the world flood the Underworld's servers and plunge the Human Empire into utter chaos. Asuna Yuuki and her friends defend their new allies with everything they have, but their numbers are falling. Meanwhile, Alice Zuberg heads toward the World's End Altar while Gabriel ""Vecta"" Miller relentlessly pursues her.

Meanwhile, members of Rath strategize a plan in an attempt to restore Kirito's damaged fluctlight. However, the intruders occupying the main control room have other plans. Surrounded by death and despair, when all hope seems to be lost, one voice reaches out to Kirito—a familiar one saying, ""I will always be by your side.""

Sword Art Online: Alicization - War of Underworld 2nd Season is the epic conclusion to Akihiko Kayaba's dream of creating artificial human intelligence. Now it is up to Kirito and his friends to protect this collapsing world from the people that still think it is just a game.

[Written by MAL Rewrite]",A-1 Pictures,"Jul 12, 2020",
8,Uzaki-chan wa Asobitai!,"['Comedy', 'Ecchi']","At the start of her freshman year in college, Hana Uzaki reunites with Shinichi Sakurai, an upperclassman who was in the same club as her during her high school days. However, much to her surprise, the once active senior has ended up becoming a ""lonesome"" student, preferring to spend his free time in quiet peace.

Uzaki does whatever she can to keep Sakurai from being ""alone,"" from convincing him to go to the movies to going to his part-time workplace. While Sakurai finds her irritating and tiresome, he still goes along with Uzaki's hijinks and shenanigans, even if he knows that her perky personality will only lead the two of them into various comical situations.

Even so, as the days pass by, their relationship only gets better, to the point where people around them misinterpret them to be a couple. At any rate, whenever Uzaki wants to hang out with her upperclassman, fun and adorable wackiness is sure to follow!

[Written by MAL Rewrite]",ENGI,"Jul 10, 2020",
9,Deca-Dence,"['Action', 'Adventure', 'Sci-Fi']","Far in the future, the lifeforms known as Gadoll suddenly arose as a threat to humanity. The last surviving humans on Earth confine themselves to the Tank, a lower district in the giant mobile fortress Deca-Dence. While the Gears who live on the upper floors are warriors who go out to fight as part of the Power, most Tankers are content to provide support from the backlines, butchering Gadoll meat and reinforcing defenses. Natsume is among those who would rather go to the front lines; undeterred by her prosthetic right arm, she seeks to join the small number of Tanker soldiers who join the Gears in combat. 

But despite her peers at the orphanage each receiving their work assignments, Natsume’s enlistment to the Power remains unapproved. In the meantime, she begins a job as a cleaner in an armor repair team led by the hard-nosed and apathetic Kaburagi, who seems to be more than he lets on. Though initially cold to his idealistic subordinate, he soon recognizes in her the potential to upset the status quo of the world. As Natsume’s new mentor, Kaburagi prepares her for the special and unique role as a game-changing bug in the system.

[Written by MAL Rewrite]",Nut,"Jul 8, 2020",
10,Monster Musume no Oishasan,"['Comedy', 'Fantasy', 'Romance', 'Ecchi']","After years of conflict, humans and monsters have settled their differences and are now at peace. This post-war era led to the foundation of Lindworm—a town which has since become the focal point of racial harmony.

As a human doctor specializing in monster biology, Glenn Litbeit runs a small clinic alongside his partner, Saphentite Neikes, who is a half-snake monster known as a lamia. He uses his knowledge to tend to any monsters who seek his aid. Whatever affliction, concern, or injury it may be, he will always be there, ready to help.

[Written by MAL Rewrite]",Arvo Animation,"Jul 12, 2020",
11,Peter Grill to Kenja no Jikan,"['Comedy', 'Fantasy', 'Ecchi']","After gaining the title of the strongest warrior in the world, Peter Grill has finally proven his worth and is ready to take the hand of his beloved senior, the beautiful and innocent Luvelia Sanctos. Peter expects to have a healthy relationship with her, despite some objections from her father.

Unfortunately, this dream quickly breaks apart as news of his grand victory spreads among the womenfolk of other races—ogres, orcs, elves, and others—some of them even vying for his seed to produce offspring blessed with his might. To avoid betraying the trust of his cherished Luvelia and causing a scandal, Peter strives to avoid other women's salacious advances. However, accomplishing such a feat with so many alluring women on his trail is easier said than done.

[Written by MAL Rewrite]",Wolfsbane,"Jul 11, 2020",
12,Dokyuu Hentai HxEros,"['Action', 'Comedy', 'Supernatural', 'Ecchi']","Five years ago, alien beings known as the ""Kiseichuu'' invaded the world. With the species endangered, the Kiseichuu are determined to take over Earth through a deadly plan that would gradually wipe out the human race: take away humanity's sexual drive using various methods, letting them die out. In response to the Kiseichuus' scheme, the HxEros device was developed—a powerful weapon that only those with high levels of erotic energy can utilize at its maximum capacity. 

Retto Enjou, a high schooler harboring an immense hatred toward the Kiseichuu, joins a group of HxEros users to fight against them and protect humankind. With their gear reliant on erotic energy as a source of power, the team must work together to maintain high levels of libido to ensure their readiness for combat at any given time. Moreover, as he lives in a house full of lustful girls, Enjou should not expect a shortage of power anytime soon.

[Written by MAL Rewrite]",Project No.9,"Jul 4, 2020",
13,No Guns Life 2nd Season,"['Action', 'Drama', 'Sci-Fi']",Second half of No Guns Life.,Madhouse,"Jul 10, 2020",
14,Gibiate,"['Action', 'Fantasy', 'Horror']","The story takes place in Japan. The year is 2030 and Earth has been completely overrun by a viral disease named ""Gibia"" that turns infected people into various different monsters, based on their age, sex, and race.

A samurai and a ninja from the early Edo period travel together through time and arrive in a ruined Japan to aid a professor working on a cure for the virus.

Together, they fight countless Gibia monsters, outlaws, and other fierce foes on their journey to save mankind.",l-a-unch・BOX,"Jul 15, 2020",
15,Koi to Producer: EVOL×LOVE,"['Mystery', 'Romance', 'Sci-Fi']","After her father passed away, a young woman inherited his production company, Miracle Entertainment, along with its most successful program, ""Miracle Finder."" In recent years, however, the show has fallen off the radar and it is now mostly forgotten. In an attempt to save the show from being canceled, this young woman desperately tries to look for a unique topic to use as inspiration. She finds it in the form of ""Evol,"" a mysterious gene that has granted certain people special powers and is considered the next step in human evolution. But, as marvelous as this gene seems, its existence may lead to an unstoppable battle between humans for survival.

However, as she becomes more entangled with the strange world of the ""Evolvers,"" her life is suddenly disturbed by the arrival of four men: the cheerful idol Kira; the neuroscientist and Loveland University professor, Simon; the stoic CEO of Loveland Financial Group and Miracle Entertainment's benefactor, Zen; and her high school upperclassman Haku, a former delinquent now working as a police officer.

As strange incidents begin to plague the city, will she be able to find out the truth about the ""Evol"" or ""Black Swan,"" the organization behind numerous attacks from ""Evolvers"" and possibly connected to her father's death? What is her part to play in its plan, and how are the men around her connected to it all?

[Written by MAL Rewrite]",MAPPA,"Jul 16, 2020",
16,Lapis Re:LiGHTs,Fantasy,"Tiara, a princess from the kingdom of Waleland, travels to the city of Mamkestell to attend a prestigious academy for those who practice magic like herself. After passing a test to prove her eligibility, Tiara reunites with her childhood friend Rosetta, who is also a student there. She then joins and meets Rosetta's group: the athletic Lavie, the reliable Ashley, and the bookish Lynette—all of whom Tiara quickly befriends.

In this institution, students are placed into one of three ranks based on their test score: group Noir being the highest, followed by Rouge and Lapis. Tiara's group is ranked Lapis, and if that wasn't enough, those who fail while ranked Lapis face expulsion. Realizing their dire situation, Tiara urges everyone to start taking their activities more seriously.

On top of this, Tiara has one more purpose for excelling at the academy: to become more like her elder sister, who is a very skilled singer. However, to reach the stage that she desires, she will have to overcome many challenges, along with her companions, as she continues her magical journey.

[Written by MAL Rewrite]",Yokohama Animation Lab,"Jul 4, 2020",
17,Muhyo to Rouji no Mahouritsu Soudan Jimusho 2nd Season,"['Action', 'Comedy', 'Drama', 'Mystery', 'Supernatural']",Second season of Muhyo to Rouji no Mahouritsu Soudan Jimusho.,Studio Deen,"Jul 7, 2020",
18,Ninja Collection,"['Horror', 'Supernatural']","Set in modern-day Tokyo where dreams and desires are afloat, a group of ninjas called ""Toukeshuu"" is set to stop the spread of ""darkness"" that prevails in the world using ancient techniques passed down through generations.

(Source: MAL News)",DRAWIZ,"Jul 13, 2020",
19,Umayon,Comedy,"It's a ""pop"" and cute everyday anime based on the 4-koma manga featuring the characters from Uma Musume: Pretty Derby.",DMM.futureworks,"Jul 7, 2020",
20,Chou Futsuu Toshi Kashiwa Densetsu R,"['Comedy', 'Fantasy']","A gag anime set in Kashiwa, featuring high school girls and mysterious creatures.

(Source: Chou Futsuu Toshi Kashiwa Densetsu Wiki)",Super Normal Studio,"Jul 6, 2020",
21,Arad: Gyakuten no Wa,"['Action', 'Adventure', 'Comedy', 'Fantasy']",Sequel to Arad: Suming Zhi Men.,LIDENFILMS,"Jul 4, 2020",
22,Get Up! Get Live! #Geragera,"['Comedy', 'Slice of Life']","The story of the ""voice actor x 2D entertainer"" project centers on aspiring comedian entertainers who all gather at SSS, a talent agency for comedians. The story portrays the friction and jealousy in their rivaling careers, as well as their admiration towards industry veterans, their disappointments, and the obstacles to their success as they aspire to become the greatest entertainers in Japan and the world.

(Source: ANN)",Spell Bound,"Jul 11, 2020",
23,Hulaing Babies Aratame: Staying Babies,"['Comedy', 'Slice of Life']","The girls formed a hula club but the new coronavirus disease (COVID-19) has halted further club activity. It will outline various preventative measures against the virus.

(Source: AniDB)",Fukushima Gaina,"Jun 10, 2020",
24,Taeko no Nichijou 2nd Season,Slice of Life,Sequel of Taeko no Nichijou.,DLE,"Jul 1, 2020",
25,One Piece,"['Action', 'Adventure', 'Fantasy']","Gol D. Roger was known as the ""Pirate King,"" the strongest and most infamous being to have sailed the Grand Line. The capture and execution of Roger by the World Government brought a change throughout the world. His last words before his death revealed the existence of the greatest treasure in the world, One Piece. It was this revelation that brought about the Grand Age of Pirates, men who dreamed of finding One Piece—which promises an unlimited amount of riches and fame—and quite possibly the pinnacle of glory and the title of the Pirate King.

Enter Monkey D. Luffy, a 17-year-old boy who defies your standard definition of a pirate. Rather than the popular persona of a wicked, hardened, toothless pirate ransacking villages for fun, Luffy's reason for being a pirate is one of pure wonder: the thought of an exciting adventure that leads him to intriguing people and ultimately, the promised treasure. Following in the footsteps of his childhood hero, Luffy and his crew travel across the Grand Line, experiencing crazy adventures, unveiling dark mysteries and battling strong enemies, all in order to reach the most coveted of all fortunes—One Piece.

[Written by MAL Rewrite] ",Toei Animation,"Oct 20, 1999",8.65
26,Black Clover,"['Action', 'Comedy', 'Fantasy']","Asta and Yuno were abandoned at the same church on the same day. Raised together as children, they came to know of the ""Wizard King""—a title given to the strongest mage in the kingdom—and promised that they would compete against each other for the position of the next Wizard King. However, as they grew up, the stark difference between them became evident. While Yuno is able to wield magic with amazing power and control, Asta cannot use magic at all and desperately tries to awaken his powers by training physically.

When they reach the age of 15, Yuno is bestowed a spectacular Grimoire with a four-leaf clover, while Asta receives nothing. However, soon after, Yuno is attacked by a person named Lebuty, whose main purpose is to obtain Yuno's Grimoire. Asta tries to fight Lebuty, but he is outmatched. Though without hope and on the brink of defeat, he finds the strength to continue when he hears Yuno's voice. Unleashing his inner emotions in a rage, Asta receives a five-leaf clover Grimoire, a ""Black Clover"" giving him enough power to defeat Lebuty. A few days later, the two friends head out into the world, both seeking the same goal—to become the Wizard King!

[Written by MAL Rewrite]",Pierrot,"Oct 3, 2017",8.12
27,Boruto: Naruto Next Generations,"['Action', 'Adventure', 'Fantasy']","Following the successful end of the Fourth Shinobi World War, Konohagakure has been enjoying a period of peace, prosperity, and extraordinary technological advancement. This is all due to the efforts of the Allied Shinobi Forces and the village's Seventh Hokage, Naruto Uzumaki. Now resembling a modern metropolis, Konohagakure has changed, particularly the life of a shinobi. Under the watchful eye of Naruto and his old comrades, a new generation of shinobi has stepped up to learn the ways of the ninja.

Boruto Uzumaki is often the center of attention as the son of the Seventh Hokage. Despite having inherited Naruto's boisterous and stubborn demeanor, Boruto is considered a prodigy and is able to unleash his potential with the help of supportive friends and family. Unfortunately, this has only worsened his arrogance and his desire to surpass Naruto which, along with his father's busy lifestyle, has strained their relationship. However, a sinister force brewing within the village may threaten Boruto's carefree life.

New friends and familiar faces join Boruto as a new story begins in Boruto: Naruto Next Generations.

[Written by MAL Rewrite]",Pierrot,"Apr 5, 2017",
28,Shokugeki no Souma: Gou no Sara,"['Gourmet', 'Ecchi']","Thanks to Souma Yukihira, Erina Nakiri, and the rebel forces overthrowing the regime of Azami Nakiri—the previous school director—and the former Elite Ten, Tootsuki Culinary Academy is back in order. However, its students have one more great battle ahead of them: the BLUE, a competition where young chefs seeking world-class fame compete. Faced with new trials and rivals, Souma and his friends will fight to conquer the BLUE and to defeat Asahi Saiba, the leader of an underworld organization of chefs known as Noir, who once defeated Souma and his father in a Shokugeki.

[Written by MAL Rewrite]",J.C.Staff,"Apr 11, 2020",
29,Fruits Basket 2nd Season,"['Drama', 'Romance', 'Supernatural']","A year has passed since Tooru Honda began living in the Souma residence, and she has since created stronger relationships with its inhabitants Shigure, Kyou, and Yuki. She has also grown closer to the rest of the Souma family and has become familiar with their ancestral secret, having helped them with many of their personal issues. The closer Tooru gets, however, the more she begins to realize that their secret holds a darker truth than she first presumed.

Summer is approaching and Tooru is invited to spend her days with the Soumas, mainly Kyou and Yuki. Tooru wishes for an easy-going vacation, but her close relationships with the two boys and the rest of the Soumas may prove to cause trouble. As they grow more intimate, their carefree time together is hindered by older hardships and feelings from the past that begin to resurface. The Eternal Banquet also dawns on the members of the zodiac, and they must tend to their duties alongside the unnerving head of the family, Akito Souma.

With the banquet approaching and a plethora of feelings to be solved, will Tooru's life with the Soumas remain peaceful, or will she find herself in a situation from which she cannot escape?

[Written by MAL Rewrite]",TMS Entertainment,"Apr 7, 2020",8.57
