,Anime,Genre,Description,Studio,Year,Rating
54,World Trigger,"['Action', 'Sci-Fi', 'Supernatural']","When a gate to another world suddenly opens on Earth, Mikado City is invaded by strange creatures known as ""Neighbors,"" malicious beings impervious to traditional weaponry. In response to their arrival, an organization called the Border Defense Agency has been established to combat the Neighbor menace through special weapons called ""Triggers."" Even though several years have passed after the gate first opened, Neighbors are still a threat and members of Border remain on guard to ensure the safety of the planet.

Despite this delicate situation, members-in-training, such as Osamu Mikumo, are not permitted to use their Triggers outside of headquarters. But when the mysterious new student in his class is dragged into a forbidden area by bullies, they are attacked by Neighbors, and Osamu has no choice but to do what he believes is right. Much to his surprise, however, the transfer student Yuuma Kuga makes short work of the aliens, revealing that he is a humanoid Neighbor in disguise.

[Written by MAL Rewrite]",Toei Animation,"Oct 5, 2014",
56,Mobile Suit Gundam: Iron-Blooded Orphans,"['Action', 'Drama', 'Sci-Fi']","Over three hundred years have passed since the Calamity War, the great conflict between Earth and its outer space colonies. Now Earth is ruled over by four economic blocs, and the military organization Gjallarhorn is responsible for keeping the peace. Mars, on the other hand, depends heavily on Earth's economy.

Horrified by the appalling living conditions that Mars' inhabitants have to bear, Kudelia Aina Bernstein, a young aristocrat from the Chryse Autonomous Region, gets involved in the Red Planet's independence movement. She hires the services of a local company, Chryse Guard Security (CGS), to escort her on the journey to Earth to negotiate economic conditions with the earthly bloc that controls the region. The Third Army Division—consisting of Mikazuki Augus, Orga Itsuka, and many other child soldiers—are chosen to protect her.

When Gjallarhorn attacks the CGS facilities to assassinate the young revolutionary threatening their interests, Orga and his comrades must not let the attackers accomplish their goal—in fact, Gjallarhorn's actions might turn out to be the unintentional catalyst that leads the children to be the forgers of their own destiny.

[Written by MAL Rewrite]",Sunrise,"Oct 4, 2015",8.04
57,Osomatsu-san,Comedy,"The majority of the Matsuno household is comprised of six identical siblings: self-centered leader Osomatsu, manly Karamatsu, voice of reason Choromatsu, cynical Ichimatsu, hyperactive Juushimatsu, and lovable Todomatsu. Despite each one of them being over the age of 20, they are incredibly lazy and have absolutely no motivation to get a job, choosing to live as NEETs instead. In the rare occurrence that they try to look for employment and are somehow able to land an interview, their unique personalities generally lead to their swift rejection.

From trying to pick up girlfriends to finding the perfect job, the daily activities of the Matsuno brothers are never dull as they go on all sorts of crazy, and often downright bizarre, adventures. Though they desperately search for a way to improve their social standing, it won't be possible if they can't survive the various challenges that come with being sextuplets!

[Written by MAL Rewrite]",Pierrot,"Oct 6, 2015",
58,Heavy Object,"['Action', 'Sci-Fi']","In the distant future, the nature of war has changed. ""Objects""—massive, spherical tanks impermeable to standard weaponry and armed with destructive firepower—rule the battlefield; their very deployment ensures victory, rendering traditional armies useless. However, this new method of warfare is about to be turned on its head.

Qwenthur Barbotage, a student studying Object Design, and Havia Winchell, a radar analyst of noble birth, serve in the Legitimate Kingdom's 37th Mobile Maintenance Battalion, tasked with supporting the Baby Magnum, one of the nation's Objects. Unfortunately, a battle gone awry places the duo in a precarious situation: mere infantry stand face-to-face against the unfathomable might of an enemy Object. As they scramble to save themselves and their fellow soldiers, a glimmer of hope shines through, and the world's perception of Objects is changed forever.

Heavy Object follows these two soldiers alongside Milinda Brantini, the Baby Magnum's pilot, and their commanding officer Frolaytia Capistrano as the unit treks all over the globe to fight battle after battle. Facing one impossible situation after another, they must summon all their wit and courage to overcome the insurmountable foes that are Objects.

[Written by MAL Rewrite]",J.C.Staff,"Oct 3, 2015",
59,Diamond no Ace: Second Season,Sports,"After the National Tournament, the Seidou High baseball team moves forward with uncertainty as the Fall season quickly approaches. In an attempt to build a stronger team centered around their new captain, fresh faces join the starting roster for the very first time. Previous losses weigh heavily on the minds of the veteran players as they continue their rigorous training, preparing for what will inevitably be their toughest season yet.
 
Rivals both new and old stand in their path as Seidou once again climbs their way toward the top, one game at a time. Needed now more than ever before, Furuya and Eijun must be determined to pitch with all their skill and strength in order to lead their team to victory. And this time, one of these young pitchers may finally claim that coveted title: ""The Ace of Seidou.""

[Written by MAL Rewrite]",Madhouse,"Apr 6, 2015",8.3
60,Utawarerumono: Itsuwari no Kamen,"['Action', 'Drama', 'Fantasy']","Waking up cold and alone in the woods, a nameless man is surrounded by unfamiliar scenes. Without any memories, he is utterly lost until he stumbles upon Kuon—a young girl with animal ears and a tail. She saves him, leading him back to her town while protecting them both from ""boro-gigiri""—giant centipede-like creatures—and a mysterious red slime. After they arrive, she names him Haku after a prominent historical figure from the area. He quickly realizes he is one of a kind—the only one without animal ears and a tail. The two journey to the capital of Yamato, the country in which Kuon lives, meeting more people and making new friends, all the while unknowingly delving deeper into the politics and inner conflicts of Yamato...

Utawarerumono: Itsuwari no Kamen follows Haku as he slowly uncovers the secrets of this alien world. He works to solve the mysteries surrounding the red slimes, as well as to stop war from erupting among the nearby countries.

[Written by MAL Rewrite]",White Fox,"Oct 4, 2015",
62,Lupin III (2015),"['Action', 'Adventure', 'Comedy', 'Mystery']","Lupin is the main character in this series which takes place in Italy and San Marino.

Reflecting its setting, the anime debuted in Italy before it aired in Japan. Lupin III fans will note that the titular thief now dons a blue coat, following his earlier appearances in green (first series and some OVAs), red (the second series as well as most films and television specials) and pink (third series).

(Source: Crunchyroll)",Telecom Animation Film,"Oct 2, 2015",
64,Aikatsu!,Slice of Life,"An idol's brilliance illuminates the dreams of humanity. Starlight Academy, a holy ground for celebrities in training, seeks to realize this belief. Behind its rigorous entrance requirements lie not only the top young stars in the entertainment business, but some of the best memories these students will ever have.

Or so Aoi Kiriya believes. Alongside her best friend Ichigo, Aoi decides to apply for the prestigious private school in hopes of living up to the praise of the biggest idol in the world: Mizuki Kanzaki. As they journey through the numerous laughs, friendships, and heartbreaks that await them, can the two girls light up the lives of others as Mizuki has done for them?

Whether it be chopping down Christmas trees, traversing obstacle courses, or even rock climbing, there's always a playful new adventure to be found in the world of Aikatsu!.

[Written by MAL Rewrite]",Bandai Namco Pictures,"Oct 8, 2012",
65,Garo: Guren no Tsuki,"['Action', 'Fantasy', 'Supernatural']","Monsters known as ""Horrors"" have invaded the world, entering through gates from the Makai Realm of Darkness. These corrupt, demonic creatures have the ability to seize human bodies and feed on their souls. Citizens who are out past sunset will likely never see the sun rise again, but those who live in the capital city have no need to worry—they are protected by a spiritual force field created by the sorcerer group Onmyouji.

In possession of legendary armor, the Golden Knight Raikou proclaims that he will protect everyone from the Horrors. Accompanied by his attendant Kintoki and the mysterious Makai Alchemist Seimei, he strives to become a formidable Makai Knight, but Raikou is ill-prepared to handle the side effects of the armor. Disappointed by his own shortcomings, he sets out on a journey of self-discovery to master his weaknesses and prove his worth.

[Written by MAL Rewrite]
",MAPPA,"Oct 10, 2015",
67,JK Meshi!,"['Comedy', 'Gourmet']","Three high school girls have mastered the art of cooking simple, B-class dishes called JK meshi. The three girls — Reina, Ryouka, and Ruriko — are all classmates in their second year of high school. They often get distracted when studying for tests, and when they do, they cook JK meshi.

(Source: ANN)",Kyotoma,"Oct 6, 2015",
68,Kindaichi Shounen no Jikenbo Returns 2nd Season,Mystery,"Hajime Kindaichi once again becomes embroiled in solving baffling cases and deciphering puzzling crimes that would confound the most seasoned of detectives. Whether it's a gruesome murder and shady circumstances surrounding the Japanese board game Go; a perplexing and macabre case involving a mysterious character, ""Rosenkreutz,"" and blue roses; or blood curdling crimes associated with an urban legend at a winter ski resort – Hajime is out to crack them all!

(Source: YTV)",Toei Animation,"Oct 3, 2015",
69,Cardfight!! Vanguard G: GIRS Crisis-hen,Action,The first half of the second season of Cardfight!! Vanguard G series.,TMS Entertainment,"Oct 11, 2015",
71,Itoshi no Muco,"['Comedy', 'Slice of Life']","Muco is the sweetest, most lovable dog in the neighborhood. This sparkly-nosed Shiba Inu lives with her owner and best friend, Komatsu, a glassblower who lives in the mountains. These two companions have wonderful adventures, from going on walks to playing in the pond in front of their house. No matter where they go or what they do, Muco will always love her best friend Komatsu!

[Written by MAL Rewrite]",DLE,"Oct 3, 2015",
72,Future Card Buddyfight Hundred,[],"While Tasuku is off training and getting rest in the world of the monsters, the Buddy Police sees the need to deputize some of the champions to help protect the Earth. Gao, Tetsuya, and Zanya Kisaragi are among those deputized, and it's just in time. A new enemy arrives, Ikazuchi, with the deadly 100 demons, all rogue monsters. Now the new trainees and the Great 8 monsters must fight to protect Earth from being consumed by these new rogues.

(Source: ANN)",OLM,"Apr 11, 2015",
73,Brave Beats,Adventure,"Hibiki Kazaguruma, a sixth grader, meets an amusing little robot named Bureikin while coming home from school one day. Bureikin, a dancer from an alternate-dimension dance world, challenged the dance king for the throne and lost. He has been deprived of Dance Stones (the stones of dance power) and sent to the human world. To restore his power, Bureikin must collect all the Dance Stones scattered around Earth.

(Source: ANN)",Bandai Namco Pictures,"Oct 11, 2015",
75,Battle Spirits: Burning Soul,[],"In the near future, a battle card game called ""Battle Spirits"" has gained enormous popularity. Players of the game—known as ""Battlers""—start duelings everywhere using their color-coded cards with different attributes, creating a ""Sengoku (Warring States) period"" for the game.

(Source: ANN)",Bandai Namco Pictures,"Apr 1, 2015",
76,Shin Atashin'chi,"['Comedy', 'Slice of Life']","Outrageous misadventures of an almost normal family with a housewife, her husband, and their two kids Yuusuke and Mikan. Wacky humor about this weird family's daily life.

(Source: AniDB)",Shin-Ei Animation,"Oct 6, 2015",
77,Kyoufu! Zombie Neko,Comedy,"The series of ""warm and soothing"" anime shorts will follow a cat who is suddenly resurrected from the grave and begins to wander around town. Despite being a zombie, the cat is able to get all the townsfolk to fall in love with it.

(Source: ANN)",Kachidoki Studio,"Oct 2, 2015",
78,Mini Van 2nd Season,"['Comedy', 'Slice of Life']",An animated flash series of the manga Mini Vanguard.,DLE,"Oct 3, 2015",
81,Xia Lan,"['Action', 'Adventure', 'Drama', 'Fantasy', 'Supernatural']","When Nian Chi was a young child, his elder sister was kidnapped in front of him, while he could do nothing but watch, a thing that has tormented him for all these years. Now 10 years later, he's dead set on going to rescue his sister, and sets out.",Beijing Rocen Digital,"Jan 29, 2012",
82,Good Morning!!! Doronjo,Comedy,(No synopsis yet.),Oddjob,"Mar 30, 2015",
83,Bary-san no Imabari-ben Kouza,Comedy,Stars Ehime Prefecture's mascot Barysan.,Kachidoki Studio,"Jul 7, 2015",
84,Nyanfuru,Comedy,"Shorts that feature music note cats. The series premiered on February 22, 2014 on television; the first episode was published on an official YouTube channel that same day. 

The whole world is in love with character illustrations of cats, dogs, and bears. A brand-new show, and the first of its kind in Japan, featuring nothing but cat characters for cat lovers started airing in February 2014. A variety of cat characters designed by Japan's topnotch creators and illustrators are animated and they are voiced by popular KAWAII (cute) anime voice actors. This show is a must-see not just for the fans of cat characters but for all anime lovers!

(Source:  YouTube)",MMDGP,"Feb 22, 2014",
86,Happy Jozy,Comedy,A comedic family of Americans experience life in Japan.,Kachidoki Studio,"Apr 3, 2015",
87,Tetsujin 28-gou Gao!,Slice of Life," This series of anime shorts, roughly five minutes in length, will focus on protagonist Shoutarou Kaneda's everyday life instead of focusing on battle scenes as previous Tetsujin 28 titles have done. The visuals of the title robot, its nemesis Black Ox, and other elements will have a pop-art style.

(Source: ANN)",Eiken,"Apr 6, 2013",
88,Himitsukessha Taka no Tsume DO,Comedy,Sequel to the previous season of the flash anime series.,DLE,"Apr 3, 2015",
89,Hello Jadoo,Slice of Life,"Hello Jadoo is a South-Korean TV show about a girl named Choi Jadoo who is a very free-spirited girl. In every episode, she would always get into drama, whether it was with her parents or school. At the same time, she meets new people and she tries to solve problems occurring.",nan,"Jul 18, 2011",
90,Kotori Samba,Comedy,"Kotori are people who love singing and dancing. Protecting the island they reside on is a calm and anxious Melonia (Melon), a weak and lazy Chocola (Chocolate), a friendly Berrina (Berry) who is fashionable as heck.  ",Music,"Apr 6, 2015",
0,Mob Psycho 100,"['Action', 'Comedy', 'Supernatural']","Eighth-grader Shigeo ""Mob"" Kageyama has tapped into his inner wellspring of psychic prowess at a young age. But the power quickly proves to be a liability when he realizes the potential danger in his skills. Choosing to suppress his power, Mob's only present use for his ability is to impress his longtime crush, Tsubomi, who soon grows bored of the same tricks.

In order to effectuate control on his skills, Mob enlists himself under the wing of Arataka Reigen, a con artist claiming to be a psychic, who exploits Mob's powers for pocket change. Now, exorcising evil spirits on command has become a part of Mob's daily, monotonous life. However, the psychic energy he exerts is barely the tip of the iceberg; if his vast potential and unrestrained emotions run berserk, a cataclysmic event that would render him completely unrecognizable will be triggered. The progression toward Mob's explosion is rising and attempting to stop it is futile.

[Written by MAL Rewrite]",Bones,"Jul 11, 2016",8.48
1,Shokugeki no Souma: Ni no Sara,"['Gourmet', 'Ecchi']","The qualifiers of the Autumn Elections are now over, and only eight talented chefs remain. Now, they face off in one-on-one food wars, each with their own unique themes. Met with both new judges and new opponents all with their own specialties, Souma must stay on his toes if he hopes to make it to the top of both the Autumn Elections and Tootsuki Culinary Academy.

[Written by MAL Rewrite]",J.C.Staff,"Jul 2, 2016",8.11
2,Saiki Kusuo no Ψ-nan,"['Comedy', 'Supernatural']","To the average person, psychic abilities might seem a blessing; for Kusuo Saiki, however, this couldn't be further from the truth. Gifted with a wide assortment of supernatural abilities ranging from telepathy to x-ray vision, he finds this so-called blessing to be nothing but a curse. As all the inconveniences his powers cause constantly pile up, all Kusuo aims for is an ordinary, hassle-free life—a life where ignorance is bliss.

Unfortunately, the life of a psychic is far from quiet. Though Kusuo tries to stay out of the spotlight by keeping his powers a secret from his classmates, he ends up inadvertently attracting the attention of many odd characters, such as the empty-headed Riki Nendou and the delusional Shun Kaidou. Forced to deal with the craziness of the people around him, Kusuo comes to learn that the ordinary life he has been striving for is a lot more difficult to achieve than expected.

[Written by MAL Rewrite]",Egg Firm,"Jul 4, 2016",8.43
3,ReLIFE,"['Drama', 'Romance', 'Slice of Life']","Dismissed as a hopeless loser by those around him, 27-year-old Arata Kaizaki bounces around from one job to another after quitting his first company. His unremarkable existence takes a sharp turn when he meets Ryou Yoake, a member of the ReLife Research Institute, who offers Arata the opportunity to change his life for the better with the help of a mysterious pill. Taking it without a second thought, Arata awakens the next day to find that his appearance has reverted to that of a 17-year-old.

Arata soon learns that he is now the subject of a unique experiment and must attend high school as a transfer student for one year. Though he initially believes it will be a cinch due to his superior life experience, Arata is proven horribly wrong on his first day: he flunks all his tests, is completely out of shape, and can't keep up with the new school policies that have cropped up in the last 10 years. Furthermore, Ryou has been assigned to observe him, bringing Arata endless annoyance. ReLIFE follows Arata's struggle to adjust to his hectic new lifestyle and avoid repeating his past mistakes, all while slowly discovering more about his fellow classmates.

[Written by MAL Rewrite]",TMS Entertainment,"Jul 2, 2016",
4,Orange,"['Drama', 'Romance', 'Sci-Fi']","Naho Takamiya's first day of her sophomore year of high school is off to an uneasy start. After waking up late, she receives a strange letter addressed to her. However, the letter is from herself—10 years in the future! At first, Naho is skeptical of the note; yet, after witnessing several events described to take place, she realizes the letter really is from her 26-year-old self.

The note details that Naho's future life is filled with regrets, and she hopes that her younger self can correct the mistakes that were made in the past. The letter also warns her to keep a close eye on the new transfer student, Kakeru Naruse. Naho must be especially careful in making decisions involving him, as Kakeru is not around in the future. With the letter as her guide, Naho now has the power to protect Kakeru before she comes to regret it once more.

[Written by MAL Rewrite]",Telecom Animation Film,"Jul 4, 2016",
5,Nanatsu no Taizai: Seisen no Shirushi,"['Action', 'Adventure', 'Fantasy']","The Seven Deadly Sins, along with Elizabeth Liones and Hawk, have won the Kingdom of Leones back from the Holy Knights. At long last, it's their time to indulge in the peaceful lives they fought for. From inedible meat pies, overdue battles, unexpected stalkers, and the butterflies of first love, the Sins are accompanied by their friends in their carefree, fun-filled time together. However, the calm is broken with the premonition of a new threat, bringing upon the signs of Holy War and threatening to shatter the peace of the Sins' easygoing days.

[Written by MAL Rewrite]",A-1 Pictures,"Aug 28, 2016",
6,91 Days,"['Action', 'Drama']","As a child living in the town of Lawless, Angelo Lagusa has witnessed a tragedy: his parents and younger brother have been mercilessly slaughtered by the Vanetti mafia family. Losing everything he holds dear, he leaves both his name and hometown behind, adopting the new identity of Avilio Bruno.

Seven years later, Avilio finally has his chance for revenge when he receives a mysterious letter prompting him to return to Lawless. Obliging, he soon encounters the Vanetti don's son, Nero, and seeks to befriend him using the skills he has quietly honed for years.

Set during the Prohibition era, 91 Days tells the story of Avilio's dark, bloodstained path to vengeance, as he slowly ends each of the men involved in the killing of his family.

[Written by MAL Rewrite]",Shuka,"Jul 9, 2016",
7,New Game!,Comedy,"Since childhood, Aoba Suzukaze has loved the Fairies Story game series, particularly the character designs. So when she graduates from high school, it is no surprise that she applies to work at Eagle Jump, the company responsible for making her favorite video game. On her first day, she is excited to learn that she will be working on a new installment to the series: Fairies Story 3—and even more so under Kou Yagami, the lead character designer.

In their department are people who share the same passion for games. There is Yun Iijima, whose specialty is designing monsters; the shy Hifumi Takimoto, who prefers to communicate through instant messaging; Hajime Shinoda, an animation team member with an impressive figurine collection; Rin Tooyama, the orderly art director; Shizuku Hazuki, the game director who brings her cat to work; and Umiko Ahagon, the short-tempered head programmer.

New Game! follows Aoba and the others on their adventure through the ups and downs of game making, from making the perfect character design to fixing all the errors that will inevitably accumulate in the process.

[Written by MAL Rewrite]",Doga Kobo,"Jul 4, 2016",
8,Danganronpa 3: The End of Kibougamine Gakuen - Mirai-hen,"['Action', 'Horror', 'Mystery']","After Makoto Naegi and his fellow survivors escaped Hope's Peak Academy to the world beyond, they soon join the Future Foundation, an organization dedicated to combating despair. Just when all seems to be looking up, Naegi is arrested and tried for betrayal due to defending a malicious group of Remnants of Despair. Standing before all of the Future Foundation executives, he finds himself, along with Kyouko Kirigiri and Aoi Asahina, facing an unknown fate.

The matter at hand only escalates when the organization's supposedly impenetrable security is hacked into by a
familiar face: Monokuma. Much to Naegi's horror, the mechanical bear immediately announces the beginning of a new killing game, as moments later, the first victim appears as a signal for despair to resume its brutal conquest.

In the conclusion to Danganronpa's gripping tale of hope and despair, Naegi, the Super High School-Level Lucky Student, must once again unravel the mystery as his colleagues and friends begin falling around him. However, there are no more class trials; among the 16 desperate participants, there is only one killer—and their death means the end of this infernal game.

[Written by MAL Rewrite]",Lerche,"Jul 11, 2016",
9,Berserk,"['Action', 'Adventure', 'Drama', 'Fantasy', 'Horror', 'Supernatural']","Now branded for death and destined to be hunted by demons until the day he dies, Guts embarks on a journey to defy such a gruesome fate, as waves of beasts relentlessly pursue him. Steeling his resolve, he takes up the monstrous blade Dragonslayer and vows to exact vengeance on the one responsible, hunting down the very man he once looked up to and considered a friend.

Along the way, he encounters some unlikely allies, such as a small elf named Puck, and Isidro, a young thief looking to learn swordsmanship from the former mercenary. As the ragtag group slowly comes together after having decided to join Guts in his quest, they will face incredible danger unlike anything they have ever experienced before.

[Written by MAL Rewrite]",GEMBA,"Jul 1, 2016",
